{
  "contract_version": "courtvision-public-v1",
  "game": {
    "away": {
      "abbreviation": "DAL",
      "accent": "#00538C",
      "id": 1610612742,
      "logo_url": "https://a.espncdn.com/i/teamlogos/nba/500/dal.png",
      "name": "Dallas Mavericks",
      "name_zh": "独行侠",
      "espn_team_id": "6",
      "score": 110.0
    },
    "background": {
      "availability": {
        "message": "暂无可靠伤病与出战信息。",
        "records": [],
        "status": "unavailable",
        "time_validation": {
          "accepted_records": 0,
          "cutoff": "2026-10-21T14:57:01.728487+00:00",
          "rejected_records": 0
        }
      },
      "market": null,
      "recent_form": {
        "away": {
          "def_rating_15": 119.39927478411875,
          "net_rating_15": -7.034428425982889,
          "off_rating_15": 112.36484635813585,
          "pace_15": 104.8530817610063,
          "rebound_share_15": 0.4789564360256372,
          "three_pct_15": 0.358,
          "turnover_rate_15": 0.11389268885085915,
          "win_rate_15": 0.26666666666666666
        },
        "home": {
          "def_rating_15": 108.43677436985455,
          "net_rating_15": 8.359914953294965,
          "off_rating_15": 116.79668932314952,
          "pace_15": 96.71813836477988,
          "rebound_share_15": 0.5357288691846617,
          "three_pct_15": 0.3452,
          "turnover_rate_15": 0.12042167252601556,
          "win_rate_15": 0.6666666666666666
        }
      },
      "schedule": {
        "away": {
          "back_to_back": null,
          "basis": null,
          "reason": "no_cutoff_eligible_schedule_evidence",
          "source_refs": [],
          "status": "unavailable"
        },
        "away_back_to_back": null,
        "away_rest_days": null,
        "home": {
          "back_to_back": null,
          "basis": null,
          "reason": "no_cutoff_eligible_schedule_evidence",
          "source_refs": [],
          "status": "unavailable"
        },
        "home_back_to_back": null,
        "home_rest_days": null
      }
    },
    "game_type": "regular_season",
    "home": {
      "abbreviation": "HOU",
      "accent": "#CE1141",
      "id": 1610612745,
      "logo_url": "https://a.espncdn.com/i/teamlogos/nba/500/hou.png",
      "name": "Houston Rockets",
      "name_zh": "火箭",
      "espn_team_id": "10",
      "score": 128.0
    },
    "id": "espn:401909840",
    "matchup_history": {
      "away_team_id": 1610612742,
      "context_hash": "fb3b0389d305c51bb36d45a15e7e6092b717423a58c9da46ad6110d246e28d0c",
      "cutoff": "2026-10-21T14:57:01.728487+00:00",
      "game_id": "espn:401909840",
      "home_team_id": 1610612745,
      "matchup_relevance": "medium",
      "meeting_count": 66,
      "meetings": [
        {
          "away_score": 125,
          "away_team_id": 1610612742,
          "game_id": "0022301083",
          "home_margin": -18,
          "home_score": 107,
          "home_team_id": 1610612745,
          "is_playoffs": false,
          "played_at": "2024-03-31T19:00:00",
          "season_start": 2023,
          "series_key": null,
          "winner_team_id": 1610612742
        },
        {
          "away_score": 136,
          "away_team_id": 1610612745,
          "game_id": "0022301131",
          "home_margin": 11,
          "home_score": 147,
          "home_team_id": 1610612742,
          "is_playoffs": false,
          "played_at": "2024-04-07T15:30:00",
          "season_start": 2023,
          "series_key": null,
          "winner_team_id": 1610612742
        },
        {
          "away_score": 108,
          "away_team_id": 1610612745,
          "game_id": "0022400129",
          "home_margin": -6,
          "home_score": 102,
          "home_team_id": 1610612742,
          "is_playoffs": false,
          "played_at": "2024-10-31T20:30:00",
          "season_start": 2024,
          "series_key": null,
          "winner_team_id": 1610612745
        },
        {
          "away_score": 99,
          "away_team_id": 1610612742,
          "game_id": "0022400460",
          "home_margin": 11,
          "home_score": 110,
          "home_team_id": 1610612745,
          "is_playoffs": false,
          "played_at": "2025-01-01T20:00:00",
          "season_start": 2024,
          "series_key": null,
          "winner_team_id": 1610612745
        },
        {
          "away_score": 105,
          "away_team_id": 1610612745,
          "game_id": "0022400741",
          "home_margin": 11,
          "home_score": 116,
          "home_team_id": 1610612742,
          "is_playoffs": false,
          "played_at": "2025-02-08T15:00:00",
          "season_start": 2024,
          "series_key": null,
          "winner_team_id": 1610612742
        },
        {
          "away_score": 96,
          "away_team_id": 1610612742,
          "game_id": "0022400961",
          "home_margin": 37,
          "home_score": 133,
          "home_team_id": 1610612745,
          "is_playoffs": false,
          "played_at": "2025-03-14T20:00:00",
          "season_start": 2024,
          "series_key": null,
          "winner_team_id": 1610612745
        },
        {
          "away_score": 102,
          "away_team_id": 1610612742,
          "game_id": "0022500160",
          "home_margin": 8,
          "home_score": 110,
          "home_team_id": 1610612745,
          "is_playoffs": false,
          "played_at": "2025-11-03T20:00:00",
          "season_start": 2025,
          "series_key": null,
          "winner_team_id": 1610612745
        },
        {
          "away_score": 109,
          "away_team_id": 1610612745,
          "game_id": "0022500356",
          "home_margin": 13,
          "home_score": 122,
          "home_team_id": 1610612742,
          "is_playoffs": false,
          "played_at": "2025-12-06T20:30:00",
          "season_start": 2025,
          "series_key": null,
          "winner_team_id": 1610612742
        },
        {
          "away_score": 104,
          "away_team_id": 1610612745,
          "game_id": "0022500491",
          "home_margin": 6,
          "home_score": 110,
          "home_team_id": 1610612742,
          "is_playoffs": false,
          "played_at": "2026-01-03T20:30:00",
          "season_start": 2025,
          "series_key": null,
          "winner_team_id": 1610612742
        },
        {
          "away_score": 107,
          "away_team_id": 1610612742,
          "game_id": "0022500701",
          "home_margin": 4,
          "home_score": 111,
          "home_team_id": 1610612745,
          "is_playoffs": false,
          "played_at": "2026-01-31T20:30:00",
          "season_start": 2025,
          "series_key": null,
          "winner_team_id": 1610612745
        }
      ],
      "most_recent_meeting": {
        "away_score": 107,
        "away_team_id": 1610612742,
        "game_id": "0022500701",
        "home_margin": 4,
        "home_score": 111,
        "home_team_id": 1610612745,
        "is_playoffs": false,
        "played_at": "2026-01-31T20:30:00",
        "season_start": 2025,
        "series_key": null,
        "winner_team_id": 1610612745
      },
      "numeric_model_usage": false,
      "relevance_reasons": [
        "multiple_recent_regular_season_meetings"
      ],
      "series_summary": null,
      "source_semantics": "local historical games strictly before cutoff; team statistics when available",
      "status": "available"
    },
    "missing": [
      {
        "reason": "no eligible local evidence",
        "section": "availability"
      },
      {
        "reason": "home: roster/minutes denominator unavailable",
        "section": "roster_continuity"
      },
      {
        "reason": "away: roster/minutes denominator unavailable",
        "section": "roster_continuity"
      },
      {
        "reason": "no legal future market data available",
        "section": "market"
      },
      {
        "reason": "longitudinal minutes/availability and roster roles not sufficiently verified; no player impact conclusion",
        "section": "key_players"
      },
      {
        "reason": "ValueError: residual_model_integrity:win_probability",
        "section": "residual_model"
      }
    ],
    "neutral_site": 0,
    "official_injury_report": {
      "game_id": "espn:401909840",
      "source_url": "https://ak-static.cms.nba.com/referee/injury/Injury-Report_2026-10-21_08_30PM.pdf",
      "source_published_at": "2026-10-22T00:30:00+00:00",
      "captured_at": "2026-10-22T00:33:22.752976+00:00",
      "source_sha256": "256f21b8e92148922cbeabc7a2384493974dc4ef3f84127974b0c3d8444dd216",
      "parser_version": "nba-official-injury-live-v3",
      "status": "published",
      "report_id": "6f91460dbd9e499c10e5f3cdae79f06519417f989ed9ae6e44d3d80bedb1c398",
      "report_date": "2026-10-21",
      "report_time": "20:30",
      "coverage": "complete",
      "records": [
        {
          "team_id": 1610612742,
          "player_name": "Caleb Martin",
          "status": "out",
          "reason": "Injury/Illness - Right Thumb Sprain",
          "game_id": "espn:401909840",
          "source_url": "https://ak-static.cms.nba.com/referee/injury/Injury-Report_2026-10-21_08_30PM.pdf",
          "source_published_at": "2026-10-22T00:30:00+00:00",
          "captured_at": "2026-10-22T00:33:22.752976+00:00",
          "source_sha256": "256f21b8e92148922cbeabc7a2384493974dc4ef3f84127974b0c3d8444dd216",
          "parser_version": "nba-official-injury-live-v3"
        },
        {
          "team_id": 1610612742,
          "player_name": "Dereck Lively II",
          "status": "out",
          "reason": "Injury/Illness - Right Foot Surgery",
          "game_id": "espn:401909840",
          "source_url": "https://ak-static.cms.nba.com/referee/injury/Injury-Report_2026-10-21_08_30PM.pdf",
          "source_published_at": "2026-10-22T00:30:00+00:00",
          "captured_at": "2026-10-22T00:33:22.752976+00:00",